context,love,like,hate,date,help,dist_General Distortion,dist_No Distortion,dist_Labeling,dist_Magnification,dist_Fortune-telling,dist_Personalization,dist_Mind Reading,dist_Mental filter,dist_Emotional Reasoning,dist_Overgeneralization,dist_All-or-nothing thinking,dist_Should statements
If there is anyway you can help with resources or ideas it would mean the world to me.,0,0,0,0,1,0,0,0,0,1,0,0,0,0,0,0,0
"I basically want an outsider‚s point of view on whether I should accept this as part of the man I fell in love with and married, reject it on the grounds of how I feel (although I have a hard time with the thought of leaving him over it), or if we should try to work out some sort of compromise.",0,0,0,0,0,0,0,0,0,0,1,0,0,0,0,0,0
"I basically want an outsider‚s point of view on whether I should accept this as part of the man I fell in love with and married, reject it on the grounds of how I feel (although I have a hard time with the thought of leaving him over it), or if we should try to work out some sort of compromise.",0,0,0,0,0,0,0,0,0,0,1,0,0,0,0,0,0
In her last relationship she went out with this guy for 2.5 years and she really loved him.,1,0,0,0,0,0,0,0,0,0,0,1,0,0,0,0,0
"I believe her, and her child is two months older than mine.",0,0,0,0,0,0,0,0,0,0,0,1,0,0,0,0,0
"He loves our son and would do anything to take care of him, and he is happy to celebrate our would be 7 year boyfriend girlfriend relationship.",1,0,0,0,0,0,0,0,0,0,0,1,0,0,0,0,0
I really don’t understand any of this and I’m falling deeply into depression myself that along with the baby weight I can’t shed.,0,0,0,0,0,0,0,0,0,0,0,1,0,0,0,0,0
i miss my wife.,0,0,0,0,0,0,1,0,0,0,0,0,0,0,0,0,0
"He mentally and physically abused me, and I felt trap with him because of our lease and my continued feelings of conflicted affection and love for him.",0,0,0,0,0,0,1,0,0,0,0,0,0,0,0,0,0
I have been dating this guy for about three months now.,0,0,0,1,0,0,0,0,0,0,0,0,1,0,0,0,0
I have been dating this guy for about three months now.,0,0,0,1,0,0,0,0,0,0,0,0,1,0,0,0,0
"In the beginning of our relationship, everything was perfect and I trusted him whole-heartedly.",0,0,0,0,0,0,0,0,0,0,0,0,1,0,0,0,0
Ever since that occasion it’s been so hard for me to trust him like I did in the beginning.,0,0,0,0,0,0,0,0,0,0,0,0,1,0,0,0,0
On top of all of this my mother and a few of my close friends don’t really trust this guy or particularly care for him too which makes it even harder for me as well.,0,0,0,0,0,0,0,0,0,0,0,0,1,0,0,0,0
On top of all of this my mother and a few of my close friends don’t really trust this guy or particularly care for him too which makes it even harder for me as well.,0,0,0,0,0,0,0,0,0,0,0,0,1,0,0,0,0
On top of all of this my mother and a few of my close friends don’t really trust this guy or particularly care for him too which makes it even harder for me as well.,0,0,0,0,0,0,0,0,0,0,0,0,1,0,0,0,0
On top of all of this my mother and a few of my close friends don’t really trust this guy or particularly care for him too which makes it even harder for me as well.,0,0,0,0,0,0,0,0,0,0,0,0,1,0,0,0,0
Almost on a daily basis she accuses me of doing stuff behind her back to the point that I’m ready to leave her.,0,0,0,0,0,0,1,0,0,0,0,0,0,0,0,0,0
Almost on a daily basis she accuses me of doing stuff behind her back to the point that I’m ready to leave her.,0,0,0,0,0,0,1,0,0,0,0,0,0,0,0,0,0
Is there any way to get my parents to understand me?,0,0,0,0,0,0,0,0,0,0,0,0,0,1,0,0,0
Needless to say after I opened the flood gate memories came rushing back.,0,0,0,0,0,0,1,0,0,0,0,0,0,0,0,0,0
I think I love both of them.,1,0,0,0,0,0,1,0,0,0,0,0,0,0,0,0,0
My gut was telling me something was wrong so I decided knowing his password went on because I was concern about his drinking (recovering addict) if I could find something that would help me.,0,0,0,0,1,0,0,0,0,1,0,0,0,0,0,0,0
He got mad at me saying he can’t trust me and walked out the door.,0,0,0,0,0,0,0,0,0,1,0,0,0,0,0,0,0
His mother has been known to hold grudges and I don’t want to get on her bad side before I marry her son.,0,0,0,0,0,0,0,0,0,0,0,1,0,0,0,0,0
I have been married for 15 years.,0,0,0,0,0,0,0,1,0,0,0,0,0,0,0,0,0
He never accepts responsibility for his part in any problem.,0,0,0,0,0,0,0,1,0,0,0,0,0,0,0,0,0
He never accepts responsibility for his part in any problem.,0,0,0,0,0,0,0,1,0,0,0,0,0,0,0,0,0
He’s always been honest with me and never fails to be affectionate and tell me how much he cares about me.,0,0,0,0,0,0,0,0,0,0,0,0,0,1,0,0,0
But I can’t trust him.,0,0,0,0,0,0,0,0,0,0,0,0,0,1,0,0,0
 I’ve been dating for a year and I just can’t stand his mom!,0,0,0,1,0,0,0,0,0,0,0,1,0,0,0,0,0
"I care about nothing–not politics or current events, not my friends or family or other people, not sports or music or art.",0,0,0,0,0,0,0,1,0,0,0,0,0,0,0,0,0
"I care about nothing–not politics or current events, not my friends or family or other people, not sports or music or art.",0,0,0,0,0,0,0,1,0,0,0,0,0,0,0,0,0
"I care about nothing–not politics or current events, not my friends or family or other people, not sports or music or art.",0,0,0,0,0,0,0,1,0,0,0,0,0,0,0,0,0
"I care about nothing–not politics or current events, not my friends or family or other people, not sports or music or art.",0,0,0,0,0,0,0,1,0,0,0,0,0,0,0,0,0
"I care about nothing–not politics or current events, not my friends or family or other people, not sports or music or art.",0,0,0,0,0,0,0,1,0,0,0,0,0,0,0,0,0
"I care about nothing–not politics or current events, not my friends or family or other people, not sports or music or art.",0,0,0,0,0,0,0,1,0,0,0,0,0,0,0,0,0
Three days ago I found out that a year ago my husband sexually abused my daughter.,0,0,0,0,0,0,0,0,0,1,0,0,0,0,0,0,0
"I don’t know what to do I love my daughter very much and I love him I will protect her at all costs, I have put locks on her door locks on the bathroom and she is not left alone with him.",1,0,0,0,0,0,0,0,0,1,0,0,0,0,0,0,0
"I don’t know what to do I love my daughter very much and I love him I will protect her at all costs, I have put locks on her door locks on the bathroom and she is not left alone with him.",1,0,0,0,0,0,0,0,0,1,0,0,0,0,0,0,0
"I don’t know what to do I love my daughter very much and I love him I will protect her at all costs, I have put locks on her door locks on the bathroom and she is not left alone with him.",0,0,0,0,0,0,0,0,0,1,0,0,0,0,0,0,0
"I don’t know what to do I love my daughter very much and I love him I will protect her at all costs, I have put locks on her door locks on the bathroom and she is not left alone with him.",0,0,0,0,0,0,0,0,0,1,0,0,0,0,0,0,0
I confronted him but he denies it stating he loves our baby very much and would never hurt her.,1,0,0,0,0,0,0,0,0,1,0,0,0,0,0,0,0
but I could never not believe her.,0,0,0,0,0,0,0,0,0,1,0,0,0,0,0,0,0
I have been married for less than a year to a wife I truly adore.,0,0,0,0,0,0,0,0,0,0,0,0,0,0,1,0,0
I have been married for less than a year to a wife I truly adore.,0,0,0,0,0,0,0,0,0,0,0,0,0,0,1,0,0
"Any time that we try to resolve an issue, she blows up uses the F-word, tells me she doesn’t care about me, and doesn’t want to be in the same room with me.",0,0,0,0,0,0,0,0,0,0,0,0,0,0,1,0,0
My parents did not have a relationship like this it is just something I have felt and needed within myself since I married my husband.,0,0,0,0,0,0,1,0,0,0,0,0,0,0,0,0,0
So my boyfriend and me have been dating for more than 3 years now and we haven’t been truly & deeply happy for about 2 years of it now.,0,0,0,1,0,0,0,0,0,0,0,0,0,0,1,0,0
So my boyfriend and me have been dating for more than 3 years now and we haven’t been truly & deeply happy for about 2 years of it now.,0,0,0,1,0,0,0,0,0,0,0,0,0,0,1,0,0
It even got to the point where I would have to ask him to show me that he loves me and appreciates me and all the stuff that a boyfriend should already do for his girlfriend.,1,0,0,0,0,0,0,0,0,0,0,0,0,0,1,0,0
"I am 44, she is 43..After 3 years of dating my girlfriend ,she tells me she has herpes only because she had a breakout…she has told me the following over the years..that she was raped in college ( the story sounds ridiculous), in her early 20’s apparently ate a bunch of pills and claims the people at the psych ward tried to trick her into signing commitment papers, ended up in Florida in a BDSM relationship…came back to NY where she held 2 or 3 jobs, sleeping with someone from the office…married then divorced ( she claims her ex husband stole all of her money)…was dating another guy who apparently beat her…..",0,0,0,1,0,0,0,1,0,0,0,0,0,0,0,0,0
I have been married for 4 years now.,0,0,0,0,0,0,1,0,0,0,0,0,0,0,0,0,0
My wife was a virgin when she married me and I was not.,0,0,0,0,0,0,1,0,0,0,0,0,0,0,0,0,0
Our relationship is great and we love each other a lot.,1,0,0,0,0,0,1,0,0,0,0,0,0,0,0,0,0
He hasn’t trusted me for a long time and I’m not sure why.,0,0,0,0,0,0,1,0,0,0,0,0,0,0,0,0,0
He hasn’t trusted me for a long time and I’m not sure why.,0,0,0,0,0,0,1,0,0,0,0,0,0,0,0,0,0
He is constantly accusing me everyday about what I’m doing.he doesn’t even trust me to go to my families house or to the store.,0,0,0,0,0,0,1,0,0,0,0,0,0,0,0,0,0
I have never dated a man who didn’t lie or cheat or do something else bad to me.,0,0,0,1,0,0,0,0,0,0,0,0,0,0,1,0,0
"I was diagnosed with depression and I’m taking an SSRI for it, which has helped quite a bit, although I wouldn’t say that I’m “cured.”",0,0,0,0,1,0,1,0,0,0,0,0,0,0,0,0,0
"For the outside world, we are perfect couple, who loves adventure, travel, cooking and is madly in love.",1,0,0,0,0,0,0,0,0,0,0,0,0,0,0,1,0
"For the outside world, we are perfect couple, who loves adventure, travel, cooking and is madly in love.",1,0,0,0,0,0,0,0,0,0,0,0,0,0,0,1,0
"For the outside world, we are perfect couple, who loves adventure, travel, cooking and is madly in love.",1,0,0,0,0,0,0,0,0,0,0,0,0,0,0,1,0
We were helping my in-laws in their difficult times.,0,0,0,0,1,0,0,0,0,0,0,0,0,0,0,1,0
We were helping my in-laws in their difficult times.,0,0,0,0,1,0,0,0,0,0,0,0,0,0,0,1,0
My girlfriend and i have been dating for 5 years.,0,0,0,1,0,0,0,0,0,0,0,0,0,0,1,0,0
My girlfriend and i have been dating for 5 years.,0,0,0,1,0,0,0,0,0,0,0,0,0,0,1,0,0
"With previous boyfriends, I felt a pang of jealousy with certain circumstances – like one bf used to stay at a female friend’s house in France for holidays – but I just told myself there’s no point in going out with someone unless you trust them and that worked.",0,0,0,0,0,0,0,1,0,0,0,0,0,0,0,0,0
I find them extremely sexually arousing and I can’t help myself but thinking about them.,0,0,0,0,1,0,0,0,0,0,0,0,0,1,0,0,0
"When I was two, almost three, my mom starting dating my stepdad.",0,0,0,1,0,0,1,0,0,0,0,0,0,0,0,0,0
My stepdad has mentally & phisically abused me.,0,0,0,0,0,0,1,0,0,0,0,0,0,0,0,0,0
Is there anything that can help this?,0,0,0,0,1,0,0,0,0,0,1,0,0,0,0,0,0
"I have been dating this guy for 10 months and to be honest although it has been rocky(he was drunk and cheated on me once in the summer, one night he was too drunk and ended up sleepwalking in my apartment and saying things that were very hurtful), normally he is one of the nicest people I have ever known.",0,0,0,1,0,0,0,1,0,0,0,0,0,0,0,0,0
"I have been dating this guy for 10 months and to be honest although it has been rocky(he was drunk and cheated on me once in the summer, one night he was too drunk and ended up sleepwalking in my apartment and saying things that were very hurtful), normally he is one of the nicest people I have ever known.",0,0,0,1,0,0,0,1,0,0,0,0,0,0,0,0,0
He has also had down periods where he wasn’t sure he liked his job and was a little depressed.,0,1,0,0,0,0,0,1,0,0,0,0,0,0,0,0,0
Through it all I forgave him and tried to help him through all of it.,0,0,0,0,0,0,0,1,0,0,0,0,0,0,0,0,0
I hated her so much for such a long time and now I don’t trust her at all.,0,0,1,0,0,0,1,0,0,0,0,0,0,0,0,0,0
I hated her so much for such a long time and now I don’t trust her at all.,0,0,1,0,0,0,1,0,0,0,0,0,0,0,0,0,0
I hated her so much for such a long time and now I don’t trust her at all.,0,0,0,0,0,0,1,0,0,0,0,0,0,0,0,0,0
"I thought I dealt with it when I became a christian, letting God help me.",0,0,0,0,1,0,0,1,0,0,0,0,0,0,0,0,0
"I have three grown children who are struggling to make it on their own,and a grandchild, who in my opinion isnt being loved as I think she should be.",1,0,0,0,0,0,0,1,0,0,0,0,0,0,0,0,0
I hate it here.,0,0,1,0,0,0,0,0,0,0,0,0,0,0,0,1,0
"I have lost myself, believing that we have many things in common, and that he really loves me even though we never meet.",1,0,0,0,0,0,0,0,0,0,0,0,0,1,0,0,0
"I come up with these fantasies that his children will love me, his friends want us to be together.",1,0,0,0,0,0,0,0,0,0,0,0,0,1,0,0,0
My boyfriend and I dated for four months.,0,0,0,1,0,0,1,0,0,0,0,0,0,0,0,0,0
My boyfriend and I dated for four months.,0,0,0,1,0,0,1,0,0,0,0,0,0,0,0,0,0
Then I found out that the reason why he broke up with me was because he liked my sister.,0,1,0,0,0,0,1,0,0,0,0,0,0,0,0,0,0
"I was really hurt, but I still talked to him because I really, really cared about him.",0,0,0,0,0,0,1,0,0,0,0,0,0,0,0,0,0
I could forgive him even if he liked my sister.,0,0,0,0,0,0,1,0,0,0,0,0,0,0,0,0,0
I could forgive him even if he liked my sister.,0,1,0,0,0,0,1,0,0,0,0,0,0,0,0,0,0
I was sexually abused at a young age and it went on for several years.,0,0,0,0,0,0,0,0,0,0,1,0,0,0,0,0,0
"As far back as I can remember, he constantly abused me mentally and physically to the point I’m traumatized and scared all over my body espically my face.",0,0,0,0,0,0,1,0,0,0,0,0,0,0,0,0,0
"As far back as I can remember, he constantly abused me mentally and physically to the point I’m traumatized and scared all over my body espically my face.",0,0,0,0,0,0,1,0,0,0,0,0,0,0,0,0,0
"As far back as I can remember, he constantly abused me mentally and physically to the point I’m traumatized and scared all over my body espically my face.",0,0,0,0,0,0,1,0,0,0,0,0,0,0,0,0,0
"However when it comes to me, he hates me.",0,0,1,0,0,0,1,0,0,0,0,0,0,0,0,0,0
"and indeed he abused me to the point I blanked out and passed out, and became crippled for a while.",0,0,0,0,0,0,1,0,0,0,0,0,0,0,0,0,0
"and indeed he abused me to the point I blanked out and passed out, and became crippled for a while.",0,0,0,0,0,0,1,0,0,0,0,0,0,0,0,0,0
We have been dating for 7 months now and my parents will not approve.,0,0,0,1,0,0,0,0,0,1,0,0,0,0,0,0,0
I have been starting fights with the people I love the most to get them mad at me and then make them say something to hurt me,1,0,0,0,0,0,0,1,0,0,0,0,0,0,0,0,0
I love this man so much.,1,0,0,0,0,0,0,0,0,0,1,0,0,0,0,0,0
I never loved anyone like this before.,1,0,0,0,0,0,0,0,0,0,1,0,0,0,0,0,0
I broke up that guy’s marriage and I didn’t love him.,1,0,0,0,0,0,0,0,0,0,1,0,0,0,0,0,0
I hated myself for that.,0,0,1,0,0,0,0,0,0,0,1,0,0,0,0,0,0
I hated myself for that.,0,0,1,0,0,0,0,0,0,0,1,0,0,0,0,0,0
I think I married him to hide what I had done.,0,0,0,0,0,0,0,0,0,0,1,0,0,0,0,0,0
We communicate about everything and of course we care for each other a great deal.,0,0,0,0,0,0,0,0,1,0,0,0,0,0,0,0,0
We communicate about everything and of course we care for each other a great deal.,0,0,0,0,0,0,0,0,1,0,0,0,0,0,0,0,0
We communicate about everything and of course we care for each other a great deal.,0,0,0,0,0,0,0,0,1,0,0,0,0,0,0,0,0
"I have to two loving supportive parents who are still together, I was never abused as a child, I’ve had my share of heartbreak but it all came before college and nothing was too traumatic.",0,0,0,0,0,0,0,0,1,0,0,0,0,0,0,0,0
I have been with my boyfriend for 4 years and I love him very much.,1,0,0,0,0,0,0,0,0,0,0,1,0,0,0,0,0
"While I love him and genuinely want to grow old with him, I am fearful that this is not intelligent of me to do, nor practical to marry someone who is bipolar and seeking no treatment.",1,0,0,0,0,0,0,0,0,0,0,1,0,0,0,0,0
"I recently checked his email, which was wrong, but I now don’t know if he’ll ever forgive me for it.",0,0,0,0,0,0,0,0,0,1,0,0,0,0,0,0,0
"I recently checked his email, which was wrong, but I now don’t know if he’ll ever forgive me for it.",0,0,0,0,0,0,0,0,0,1,0,0,0,0,0,0,0
I would actually like it if a girl came into my room xD.,0,1,0,0,0,0,0,0,1,0,0,0,0,0,0,0,0
"I may be just a hypochondriac or something, but I was hoping you could help me with that.",0,0,0,0,1,0,1,0,0,0,0,0,0,0,0,0,0
"I may be just a hypochondriac or something, but I was hoping you could help me with that.",0,0,0,0,1,0,1,0,0,0,0,0,0,0,0,0,0
"I understand in principle, but I have a question.",0,0,0,0,0,0,0,0,0,0,1,0,0,0,0,0,0
We had to deny anything was wrong and no one helped me or my siblings.,0,0,0,0,1,0,0,1,0,0,0,0,0,0,0,0,0
We had to deny anything was wrong and no one helped me or my siblings.,0,0,0,0,1,0,0,1,0,0,0,0,0,0,0,0,0
I have been with my girlfriend for 7 months and I love her dearly; but since we starting going out I have noticed a lot of jelousy and lack of faith toward our relationship.,1,0,0,0,0,0,0,0,0,0,0,1,0,0,0,0,0
"Take care” For the record, I would never initiate a conversation with any of my ex’s, but at the same time I’ve always been polite, which is something I really like about myself.",0,1,0,0,0,0,0,0,0,0,0,1,0,0,0,0,0
I never doubted my friends.,0,0,0,0,0,0,0,0,0,0,1,0,0,0,0,0,0
And I dont like being like this because Im making things hard for my friends..because Im always doubting them OR guessing things that I think they might be thinking..which 99% of the times are wrong.,0,0,0,0,0,0,0,0,0,0,1,0,0,0,0,0,0
"If I love my friends like I know I do, why do I analyse everything, and say “if this, if that” etc.",1,0,0,0,0,0,0,0,0,0,1,0,0,0,0,0,0
I feel like I should isolate myself from others..because I cant be a true friend if I cant truly trust them.,0,0,0,0,0,0,0,0,0,0,1,0,0,0,0,0,0
but how can I trust my friends more.. or at least..not show them my doubts.,0,0,0,0,0,0,0,0,0,0,1,0,0,0,0,0,0
I have been dating my boyfriend for 7 months now and everything started out fine but these last few months I have started noticing a pattern.,0,0,0,1,0,0,1,0,0,0,0,0,0,0,0,0,0
I have been dating my boyfriend for 7 months now and everything started out fine but these last few months I have started noticing a pattern.,0,0,0,1,0,0,1,0,0,0,0,0,0,0,0,0,0
I love my girlfriend with all of my heart and our relationship’s on the rocks.,1,0,0,0,0,0,0,0,0,0,0,0,0,0,1,0,0
I love my girlfriend with all of my heart and our relationship’s on the rocks.,1,0,0,0,0,0,0,0,0,0,0,0,0,0,1,0,0
She gets mad when i cant trust her,0,0,0,0,0,0,0,0,0,0,0,0,0,0,1,0,0
"I don’t like it when she drinks, not only is she underage but something always bad happens when she does, and she lies about drinking.",0,1,0,0,0,0,0,0,0,0,0,0,0,0,1,0,0
"If something bad happens at a certain place, if it’s a school or a store, I’ll avoid that place to not remember the event.",0,0,0,0,0,0,0,0,0,0,0,0,0,0,1,0,0
I liked the Air Force(welding/machinist) job and a mining machinery job the best… I’ve been released from probation during the maintenance job and fired from a welding job two years ago over a dispute with the boss about timeliness/quality of my work(which he was becoming more critical about).,0,1,0,0,0,0,0,0,0,0,0,0,0,0,1,0,0
I liked the Air Force(welding/machinist) job and a mining machinery job the best… I’ve been released from probation during the maintenance job and fired from a welding job two years ago over a dispute with the boss about timeliness/quality of my work(which he was becoming more critical about).,0,1,0,0,0,0,0,0,0,0,0,0,0,0,1,0,0
"There are only two people in my life that I trust to help me out in a sticky situation, but sometimes I cannot trust them to keep personal conversations that we have to their selves.",0,0,0,0,0,0,0,0,0,0,0,1,0,0,0,0,0
"There are only two people in my life that I trust to help me out in a sticky situation, but sometimes I cannot trust them to keep personal conversations that we have to their selves.",0,0,0,0,0,0,0,0,0,0,0,1,0,0,0,0,0
"All of the time, they have told me that they told someone because they thought that they were helping me.",0,0,0,0,1,0,0,0,0,0,0,1,0,0,0,0,0
Helping them out by going out of my way.. staying outside home even after curfew time so that i can help them with their projects..,0,0,0,0,1,0,0,0,0,0,0,1,0,0,0,0,0
Helping them out by going out of my way.. staying outside home even after curfew time so that i can help them with their projects..,0,0,0,0,1,0,0,0,0,0,0,1,0,0,0,0,0
"Now that I’ve been trying to have a relationship with girls, I always make them hate me by putting myself down.",0,0,1,0,0,0,0,0,0,0,1,0,0,0,0,0,0
but I would love the freedom and good time to explore someone new.,1,0,0,0,0,0,0,0,0,0,1,0,0,0,0,0,0
but I would love the freedom and good time to explore someone new.,1,0,0,0,0,0,0,0,0,0,1,0,0,0,0,0,0
"She will believe anything her friends tell her but will never, and I do mean never, listen to the advice of those who love her.",0,0,0,0,0,0,0,0,0,0,0,0,0,0,0,0,1
"She will believe anything her friends tell her but will never, and I do mean never, listen to the advice of those who love her.",1,0,0,0,0,0,0,0,0,0,0,0,0,0,0,0,1
I’ve never loved anyone like i love him.,1,0,0,0,0,0,0,0,0,0,0,0,0,0,1,0,0
I’ve never loved anyone like i love him.,1,0,0,0,0,0,0,0,0,0,0,0,0,0,1,0,0
"Anyway, I contracted genital herpes from this guy and even after telling my boyfriend about it he still took me back which proves to me that he really does love me, even if he doesn’t always show it.",1,0,0,0,0,0,0,0,0,0,0,0,0,0,1,0,0
but i just can’t like anyone else as much as i try.,0,1,0,0,0,0,0,0,0,0,0,0,0,0,1,0,0
"So how do i know who to choose, the one i have a strong bond with and love and know loves me but is mean to me and starts fights with me all the time or the guy who is always sweet to me and makes me happy but isn’t always around and won’t be serious with me?",1,0,0,0,0,0,0,0,0,0,0,0,0,0,1,0,0
Can you help me in any way?,0,0,0,0,1,0,0,0,0,0,0,0,0,0,0,1,0
Can you help me in any way?,0,0,0,0,1,0,0,0,0,0,0,0,0,0,0,1,0
She has helped me immensely.,0,0,0,0,1,0,0,0,0,0,0,0,0,1,0,0,0
She never trusts me on any thing and The problem is of so high magnitude that I am suffocated and very much frustrated all the time.,0,0,0,0,0,0,0,0,1,0,0,0,0,0,0,0,0
She never trusts me on any thing and The problem is of so high magnitude that I am suffocated and very much frustrated all the time.,0,0,0,0,0,0,0,0,1,0,0,0,0,0,0,0,0
In spite of all this I love my wife very much and would never exit this relation.,1,0,0,0,0,0,0,0,1,0,0,0,0,0,0,0,0
In spite of all this I love my wife very much and would never exit this relation.,1,0,0,0,0,0,0,0,1,0,0,0,0,0,0,0,0
"From somewhere, and I don’t know where, it has been imprinted on my mind that if you care someone, that’s how you show it.",0,0,0,0,0,0,0,0,1,0,0,0,0,0,0,0,0
"I know, it sounds sick, but I can’t help it.",0,0,0,0,1,0,0,0,1,0,0,0,0,0,0,0,0
"I am yelling for my daddy, (my parents were separated at the time we lived in this house also) and a man in a police uniform, tucking me into bed and telling me to quit yelling and the he loved me and putting his hand over my mouth.",1,0,0,0,0,0,0,0,1,0,0,0,0,0,0,0,0
"I am getting married in May and I am scared that if this comes out, he will think differently of me because of what occurred with one of my brothers??",0,0,0,0,0,0,0,0,1,0,0,0,0,0,0,0,0
She hates her her mother and her brothers .She has been receiving treatment from various psychiatrists but nothing has helped much.,0,0,1,0,0,0,0,1,0,0,0,0,0,0,0,0,0
She hates her her mother and her brothers .She has been receiving treatment from various psychiatrists but nothing has helped much.,0,0,1,0,0,0,0,1,0,0,0,0,0,0,0,0,0
She hates her her mother and her brothers .She has been receiving treatment from various psychiatrists but nothing has helped much.,0,0,0,0,1,0,0,1,0,0,0,0,0,0,0,0,0
She does not accept her disease and thinks she has Insomia only.,0,0,0,0,0,0,0,1,0,0,0,0,0,0,0,0,0
"If I say anything about seeking treatment, she accuses me of not understanding her and what is happening to her.",0,0,0,0,0,0,1,0,0,0,0,0,0,0,0,0,0
I did not feel comfortable telling her all of the details at first so I continued lying as I felt I was protecting her already fragile state.,0,0,0,0,0,0,0,0,0,0,1,0,0,0,0,0,0
I told her tonight I fear for my life sometimes because she doesn’t seem to have control over herself when she is in a fit of rage over what I’ve done.,0,0,0,0,0,0,0,0,0,0,1,0,0,0,0,0,0
I have been told I can’t leave my house because I will be abandoning my children and the courts will not award any custody to me if I do.,0,0,0,0,0,0,0,0,0,0,1,0,0,0,0,0,0
I love my kids; I love to be around them.,1,0,0,0,0,0,0,0,0,0,1,0,0,0,0,0,0
"Or, help me to find a good counselor in my area that accepts my insurance.",0,0,0,0,0,0,0,0,0,0,1,0,0,0,0,0,0
My teachers even tried to tell my mom but I have a mother that doesn’t believe in it.,0,0,0,0,0,0,0,0,1,0,0,0,0,0,0,0,0
I grew up in a home where my parents hated each other and it was no secret.,0,0,1,0,0,0,0,0,0,0,0,0,0,1,0,0,0
I never liked my mother who is controlling and selfish.,0,1,0,0,0,0,0,0,0,0,0,0,0,1,0,0,0
My mother wouldn’t accept anything unless in her mind it was right.,0,0,0,0,0,0,0,0,0,0,0,0,0,1,0,0,0
I was only sober 2 months before I fell into a drug that helps me even know,0,0,0,0,1,0,0,0,0,0,0,0,0,0,0,1,0
"But my doctors, therapists, and family all tell me that I need to come first before I can help others.",0,0,0,0,1,0,0,0,0,0,1,0,0,0,0,0,0
How can I care for my own health as well as other people’s needs as a Christian should?,0,0,0,0,0,0,0,0,0,0,1,0,0,0,0,0,0
